,name,tipo,cmc,lealdade,texto,raridades,preços
126,"Chandra, Pyrogenius",Legendary Planeswalker — Chandra,6,Loyalty: 5,"+2: Chandra, Pyrogenius deals 2 damage to each opponent.−3: Chandra, Pyrogenius deals 4 damage to target creature.−10: Chandra, Pyrogenius deals 6 damage to target player or planeswalker and each creature that player or that planeswalker’s controller controls.",Mítica,R$ 8.90 
127,"Nissa, Nature's Artisan",Legendary Planeswalker — Nissa,6,Loyalty: 5,+3: You gain 3 life.−4: Reveal the top two cards of your library. Put all land cards from among them onto the battlefield and the rest into your hand.−12: Creatures you control get +5/+5 and gain trample until end of turn.,Mítica,R$ 29.99 
128,"Sorin, Solemn Visitor",Legendary Planeswalker — Sorin,4,Loyalty: 4,"+1: Until your next turn, creatures you control get +1/+0 and gain lifelink.−2: Create a 2/2 black Vampire creature token with flying.−6: You get an emblem with “At the beginning of each opponent’s upkeep, that player sacrifices a creature.”",Mítica,R$ 4.95 
129,Quintorius Kand,Legendary Planeswalker — Quintorius,5,Loyalty: 4,"Whenever you cast a spell from exile, Quintorius Kand deals 2 damage to each opponent and you gain 2 life.+1: Create a 3/2 red and white Spirit creature token.−3: Discover 4.−6: Exile any number of target cards from your graveyard. Add {R} for each card exiled this way. You may play those cards this turn.",Mítica,R$ 29.95 
130,Ajani Goldmane,Legendary Planeswalker — Ajani,4,Loyalty: 4,+1: You gain 2 life.−1: Put a +1/+1 counter on each creature you control. Those creatures gain vigilance until end of turn.−6: Create a white Avatar creature token. It has “This creature’s power and toughness are each equal to your life total.”,Mítica,R$ 89.00
131,"Jace, Memory Adept",Legendary Planeswalker — Jace,5,Loyalty: 4,+1: Draw a card. Target player mills a card.0: Target player mills ten cards.−7: Any number of target players each draw twenty cards.,Mítica,R$ 6.75 
132,Sorin Markov,Legendary Planeswalker — Sorin,6,Loyalty: 4,+2: Sorin Markov deals 2 damage to any target and you gain 2 life.−3: Target opponent’s life total becomes 10.−7: You control target player during that player’s next turn.,Mítica,R$ 19.50 
133,"Chandra, the Firebrand",Legendary Planeswalker — Chandra,4,Loyalty: 3,"+1: Chandra, the Firebrand deals 1 damage to any target.−2: When you cast your next instant or sorcery spell this turn, copy that spell. You may choose new targets for the copy.−6: Chandra, the Firebrand deals 6 damage to each of up to six targets.",Mítica,R$ 3.32 
134,"Ajani, Caller of the Pride",Legendary Planeswalker — Ajani,3,Loyalty: 4,"+1: Put a +1/+1 counter on up to one target creature.−3: Target creature gains flying and double strike until end of turn.−8: Create X 2/2 white Cat creature tokens, where X is your life total.",Mítica,R$ 8.90 
135,Mind Sculpt,Legendary Planeswalker — Jace,2,Loyalty: 3,"+2: Look at the top card of target player’s library. You may put that card on the bottom of that player’s library.0: Draw three cards, then put two cards from your hand on top of your library in any order.−1: Return target creature to its owner’s hand.−12: Exile all cards from target player’s library, then that player shuffles their hand into their library.",Comum,R$ 0.50 
136,Liliana of the Dark Realms,Legendary Planeswalker — Liliana,4,Loyalty: 3,"+1: Search your library for a Swamp card, reveal it, put it into your hand, then shuffle.−3: Target creature gets +X/+X or -X/-X until end of turn, where X is the number of Swamps you control.−6: You get an emblem with “Swamps you control have ‘{T}: Add {B}{B}{B}{B}.’”",Mítica,R$ 135.00 
137,"Garruk, Caller of Beasts",Legendary Planeswalker — Garruk,6,Loyalty: 4,"+1: Reveal the top five cards of your library. Put all creature cards revealed this way into your hand and the rest on the bottom of your library in any order.−3: You may put a green creature card from your hand onto the battlefield.−7: You get an emblem with “Whenever you cast a creature spell, you may search your library for a creature card, put it onto the battlefield, then shuffle.”",Mítica,R$ 57.50 
138,"Jace, the Living Guildpact",Legendary Planeswalker — Jace,4,Loyalty: 5,+1: Look at the top two cards of your library. Put one of them into your graveyard.−3: Return another target nonland permanent to its owner’s hand.−8: Each player shuffles their hand and graveyard into their library. You draw seven cards.,Mítica,R$ 2.49 
139,"Garruk, Apex Predator",Legendary Planeswalker — Garruk,7,Loyalty: 5,"+1: Destroy another target planeswalker.+1: Create a 3/3 black Beast creature token with deathtouch.−3: Destroy target creature. You gain life equal to its toughness.−8: Target opponent gets an emblem with “Whenever a creature attacks you, it gets +5/+5 and gains trample until end of turn.”",Mítica,R$ 6.47 
140,"Ajani, Adversary of Tyrants",Legendary Planeswalker — Ajani,4,Loyalty: 4,"+1: Put a +1/+1 counter on each of up to two target creatures.−2: Return target creature card with mana value 2 or less from your graveyard to the battlefield.−7: You get an emblem with “At the beginning of your end step, create three 1/1 white Cat creature tokens with lifelink.”",Mítica,R$ 9.90 
141,"Liliana, Untouched by Death",Legendary Planeswalker — Liliana,4,Loyalty: 4,"+1: Mill three cards. If at least one Zombie card is milled this way, each opponent loses 2 life and you gain 2 life.−2: Target creature gets -X/-X until end of turn, where X is the number of Zombies you control.−3: You may cast Zombie spells from your graveyard this turn.",Mítica,R$ 17.41 
142,"Sarkhan, Fireblood",Legendary Planeswalker — Sarkhan,3,Loyalty: 3,"+1: You may discard a card. If you do, draw a card.+1: Add two mana in any combination of colors. Spend this mana only to cast Dragon spells.−7: Create four 5/5 red Dragon creature tokens with flying.",Mítica,R$ 37.97 
143,Vivien Reid,Legendary Planeswalker — Vivien,5,Loyalty: 5,"+1: Look at the top four cards of your library. You may reveal a creature or land card from among them and put it into your hand. Put the rest on the bottom of your library in a random order.−3: Destroy target artifact, enchantment, or creature with flying.−8: You get an emblem with “Creatures you control get +2/+2 and have vigilance, trample, and indestructible.”",Mítica,R$ 8.50 
144,"Ajani, Wise Counselor",Legendary Planeswalker — Ajani,5,Loyalty: 5,"+2: You gain 1 life for each creature you control.−3: Creatures you control get +2/+2 until end of turn.−9: Put X +1/+1 counters on target creature, where X is your life total.",Mítica,R$ 23.90 
145,"Tezzeret, Cruel Machinist",Legendary Planeswalker — Tezzeret,6,Loyalty: 4,"+1: Draw a card.0: Until your next turn, target artifact you control becomes a 5/5 creature in addition to its other types.−7: Put any number of cards from your hand onto the battlefield face down. They’re 5/5 artifact creatures.",Mítica,R$ 5.32 
146,"Liliana, the Necromancer",Legendary Planeswalker — Liliana,5,Loyalty: 4,+1: Target player loses 2 life.−1: Return target creature card from your graveyard to your hand.−7: Destroy up to two target creatures. Put up to two creature cards from graveyards onto the battlefield under your control.,Mítica,R$ 31.49 
147,"Sarkhan, Dragonsoul",Legendary Planeswalker — Sarkhan,6,Loyalty: 5,"+2: Sarkhan, Dragonsoul deals 1 damage to each opponent and each creature your opponents control.−3: Sarkhan, Dragonsoul deals 4 damage to target player or planeswalker.−9: Search your library for any number of Dragon creature cards, put them onto the battlefield, then shuffle.",Mítica,R$ 24.97 
148,Vivien of the Arkbow,Legendary Planeswalker — Vivien,6,Loyalty: 5,+2: Put two +1/+1 counters on up to one target creature.−3: Target creature you control deals damage equal to its power to target creature you don’t control.−9: Creatures you control get +4/+4 and gain trample until end of turn.,Mítica,R$ 9.45 
149,"Mu Yanling, Sky Dancer",Legendary Planeswalker — Yanling,3,Loyalty: 2,"+2: Until your next turn, up to one target creature gets -2/-0 and loses flying.−3: Create a 4/4 blue Elemental Bird creature token with flying.−8: You get an emblem with “Islands you control have ‘{T}: Draw a card.’”",Mítica,R$ 5.95 
150,"Sorin, Imperious Bloodlord",Legendary Planeswalker — Sorin,3,Loyalty: 4,"+1: Target creature you control gains deathtouch and lifelink until end of turn. If it’s a Vampire, put a +1/+1 counter on it.+1: You may sacrifice a Vampire. When you do, Sorin, Imperious Bloodlord deals 3 damage to any target and you gain 3 life.−3: You may put a Vampire creature card from your hand onto the battlefield.",Mítica,R$ 269.90 
151,"Chandra, Acolyte of Flame",Legendary Planeswalker — Chandra,3,Loyalty: 4,"0: Put a loyalty counter on each red planeswalker you control.0: Create two 1/1 red Elemental creature tokens. They gain haste. Sacrifice them at the beginning of the next end step.−2: You may cast target instant or sorcery card with mana value 3 or less from your graveyard. If that spell would be put into your graveyard, exile it instead.",Rara,R$ 2.90 
152,"Chandra, Novice Pyromancer",Legendary Planeswalker — Chandra,4,Loyalty: 5,"+1: Elementals you control get +2/+0 until end of turn.−1: Add {R}{R}.−2: Chandra, Novice Pyromancer deals 2 damage to any target.",Incomum,R$ 0.20 
153,"Vivien, Arkbow Ranger",Legendary Planeswalker — Vivien,4,Loyalty: 4,+1: Distribute two +1/+1 counters among up to two target creatures. They gain trample until end of turn.−3: Target creature you control deals damage equal to its power to target creature or planeswalker.−5: You may reveal a creature card you own from outside the game and put it into your hand.,Mítica,R$ 11.69 
154,"Ajani, Inspiring Leader",Legendary Planeswalker — Ajani,6,Loyalty: 5,+2: You gain 2 life. Put two +1/+1 counters on up to one target creature.−3: Exile target creature. Its controller gains 2 life.−10: Creatures you control gain flying and double strike until end of turn.,Mítica,R$ 32.90 
155,"Mu Yanling, Celestial Wind",Legendary Planeswalker — Yanling,6,Loyalty: 5,"+1: Until your next turn, up to one target creature gets -5/-0.−3: Return up to two target creatures to their owners’ hands.−7: Creatures you control with flying get +5/+5 until end of turn.",Mítica,R$ 9.48 
156,"Sorin, Vampire Lord",Legendary Planeswalker — Sorin,6,Loyalty: 4,"+1: Up to one target creature gets +2/+0 until end of turn.−2: Sorin, Vampire Lord deals 4 damage to any target. You gain 4 life.−8: Until end of turn, each Vampire you control gains “{T}: Gain control of target creature.”",Mítica,R$ 45.41 
157,"Vivien, Nature's Avenger",Legendary Planeswalker — Vivien,6,Loyalty: 3,+1: Put three +1/+1 counters on up to one target creature.−1: Reveal cards from the top of your library until you reveal a creature card. Put that card into your hand and the rest on the bottom of your library in a random order.−6: Target creature gets +10/+10 and gains trample until end of turn.,Mítica,R$ 19.90 
158,Basri Ket,Legendary Planeswalker — Basri,3,Loyalty: 3,"+1: Put a +1/+1 counter on up to one target creature. It gains indestructible until end of turn.−2: Whenever one or more nontoken creatures attack this turn, create that many 1/1 white Soldier creature tokens that are tapped and attacking.−6: You get an emblem with “At the beginning of combat on your turn, create a 1/1 white Soldier creature token, then put a +1/+1 counter on each creature you control.”",Mítica,R$ 9.00 
159,"Teferi, Master of Time",Legendary Planeswalker — Teferi,4,Loyalty: 3,"You may activate loyalty abilities of Teferi, Master of Time on any player’s turn any time you could cast an instant.+1: Draw a card, then discard a card.−3: Target creature you don’t control phases out. (Treat it and anything attached to it as though they don’t exist until its controller’s next turn.)−10: Take two extra turns after this one.",Mítica,R$ 89.99 
160,"Liliana, Waker of the Dead",Legendary Planeswalker — Liliana,4,Loyalty: 4,"+1: Each player discards a card. Each opponent who can’t loses 3 life.−3: Target creature gets -X/-X until end of turn, where X is the number of cards in your graveyard.−7: You get an emblem with “At the beginning of combat on your turn, put target creature card from a graveyard onto the battlefield under your control. It gains haste.”",Mítica,R$ 26.50 
161,"Chandra, Heart of Fire",Legendary Planeswalker — Chandra,5,Loyalty: 5,"+1: Discard your hand, then exile the top three cards of your library. Until end of turn, you may play cards exiled this way.+1: Chandra, Heart of Fire deals 2 damage to any target.−9: Search your graveyard and library for any number of red instant and/or sorcery cards, exile them, then shuffle. You may cast them this turn. Add six {R}.",Mítica,R$ 9.74 
162,"Garruk, Unleashed",Legendary Planeswalker — Garruk,4,Loyalty: 4,"+1: Up to one target creature gets +3/+3 and gains trample until end of turn.−2: Create a 3/3 green Beast creature token. Then if an opponent controls more creatures than you, put a loyalty counter on Garruk, Unleashed.−7: You get an emblem with “At the beginning of your end step, you may search your library for a creature card, put it onto the battlefield, then shuffle.”",Mítica,R$ 18.90 
163,"Basri, Devoted Paladin",Legendary Planeswalker — Basri,6,Loyalty: 4,"+1: Put a +1/+1 counter on up to one target creature. It gains vigilance until end of turn.−1: Whenever a creature attacks this turn, put a +1/+1 counter on it.−6: Creatures you control get +2/+2 and gain flying until end of turn.",Mítica,R$ 22.99 
164,"Teferi, Timeless Voyager",Legendary Planeswalker — Teferi,6,Loyalty: 4,"+1: Draw a card.−3: Put target creature on top of its owner’s library.−8: Each creature target opponent controls phases out. Until the end of your next turn, they can’t phase in. (Treat them and anything attached to them as though they don’t exist.)",Mítica,R$ 44.00 
165,"Liliana, Death Mage",Legendary Planeswalker — Liliana,6,Loyalty: 4,+1: Return up to one target creature card from your graveyard to your hand.−3: Destroy target creature. Its controller loses 2 life.−7: Target opponent loses 2 life for each creature card in their graveyard.,Mítica,R$ 199.00 
166,"Chandra, Flame's Catalyst",Legendary Planeswalker — Chandra,6,Loyalty: 5,"+1: Chandra, Flame’s Catalyst deals 3 damage to each opponent.−2: You may cast target red instant or sorcery card from your graveyard. If that spell would be put into your graveyard, exile it instead.−8: Discard your hand, then draw seven cards. Until end of turn, you may cast spells from your hand without paying their mana costs.",Mítica,R$ 209.69 
167,"Ral, Caller of Storms",Legendary Planeswalker — Ral,6,Loyalty: 4,"+1: Draw a card.−2: Ral, Caller of Storms deals 3 damage divided as you choose among one, two, or three targets.−7: Draw seven cards. Ral, Caller of Storms deals 7 damage to each creature your opponents control.",Mítica,R$ 3.14 
168,"Garruk, Savage Herald",Legendary Planeswalker — Garruk,6,Loyalty: 5,"+1: Reveal the top card of your library. If it’s a creature card, put it into your hand. Otherwise, put it on the bottom of your library.−2: Target creature you control deals damage equal to its power to another target creature.−7: Until end of turn, creatures you control gain “You may have this creature assign its combat damage as though it weren’t blocked.”",Mítica,R$ 20.03 
169,"Tezzeret, Agent of Bolas",Legendary Planeswalker — Tezzeret,4,Loyalty: 3,"+1: Look at the top five cards of your library. You may reveal an artifact card from among them and put it into your hand. Put the rest on the bottom of your library in any order.−1: Target artifact becomes an artifact creature with base power and toughness 5/5.−4: Target player loses X life and you gain X life, where X is twice the number of artifacts you control.",Mítica,R$ 79.63 
170,Gideon Blackblade,Legendary Planeswalker — Gideon,3,Loyalty: 4,"As long as it’s your turn, Gideon Blackblade is a 4/4 Human Soldier creature with indestructible that’s still a planeswalker.Prevent all damage that would be dealt to Gideon Blackblade during your turn.+1: Up to one other target creature you control gains your choice of vigilance, lifelink, or indestructible until end of turn.−6: Exile target nonland permanent.",Mítica,R$ 6.19 
171,"Nicol Bolas, Dragon-God",Legendary Planeswalker — Bolas,5,Loyalty: 4,"Nicol Bolas, Dragon-God has all loyalty abilities of all other planeswalkers on the battlefield.+1: You draw a card. Each opponent exiles a card from their hand or a permanent they control.−3: Destroy target creature or planeswalker.−8: Each opponent who doesn’t control a legendary creature or planeswalker loses the game.",Mítica,R$ 20.90 
172,"Domri, Chaos Bringer",Legendary Planeswalker — Domri,4,Loyalty: 5,"+1: Add {R} or {G}. If that mana is spent on a creature spell, it gains riot. (It enters the battlefield with your choice of a +1/+1 counter or haste.)−3: Look at the top four cards of your library. You may reveal up to two creature cards from among them and put them into your hand. Put the rest on the bottom of your library in a random order.−8: You get an emblem with “At the beginning of each end step, create a 4/4 red and green Beast creature token with trample.”",Mítica,R$ 2.25 
173,Serra the Benevolent,Legendary Planeswalker — Serra,4,Loyalty: 4,"+2: Creatures you control with flying get +1/+1 until end of turn.−3: Create a 4/4 white Angel creature token with flying and vigilance.−6: You get an emblem with “If you control a creature, damage that would reduce your life total to less than 1 reduces it to 1 instead.”",Mítica,R$ 49.75 
174,Archangel Elspeth,Legendary Planeswalker — Elspeth,4,Loyalty: 4,+1: Create a 1/1 white Soldier creature token with lifelink.−2: Put two +1/+1 counters on target creature. It becomes an Angel in addition to its other types and gains flying.−6: Return all nonland permanent cards with mana value 3 or less from your graveyard to the battlefield.,Mítica,R$ 25.00 
175,"Chandra, Hope's Beacon",Legendary Planeswalker — Chandra,6,Loyalty: 5,"Whenever you cast an instant or sorcery spell, copy it. You may choose new targets for the copy. This ability triggers only once each turn.+2: Add two mana in any combination of colors.+1: Exile the top five cards of your library. Until the end of your next turn, you may cast an instant or sorcery spell from among those exiled cards.−X: Chandra, Hope’s Beacon deals X damage to each of up to two targets.",Mítica,R$ 49.90 
176,Wrenn and Realmbreaker,Legendary Planeswalker — Wrenn,3,Loyalty: 4,"Lands you control have “{T}: Add one mana of any color.”+1: Up to one target land you control becomes a 3/3 Elemental creature with vigilance, hexproof, and haste until your next turn. It’s still a land.−2: Mill three cards. You may put a permanent card from among the milled cards into your hand.−7: You get an emblem with “You may play lands and cast permanent spells from your graveyard.”",Mítica,R$ 34.95 
177,Elspeth Tirel,Legendary Planeswalker — Elspeth,5,Loyalty: 4,+2: You gain 1 life for each creature you control.−2: Create three 1/1 white Soldier creature tokens.−5: Destroy all other permanents except for lands and tokens.,Mítica,R$ 6.89 
178,The Eternal Wanderer,Legendary Planeswalker,6,Loyalty: 5,"No more than one creature can attack The Eternal Wanderer each combat.+1: Exile up to one target artifact or creature. Return that card to the battlefield under its owner’s control at the beginning of that player’s next end step.0: Create a 2/2 white Samurai creature token with double strike.−4: For each player, choose a creature that player controls. Each player sacrifices all creatures they control not chosen this way.",Rara,R$ 12.35 
179,"Jace, the Perfected Mind",Legendary Planeswalker — Jace,4,Loyalty: 5,"Compleated ({U/P} can be paid with {U} or 2 life. If life was paid, this planeswalker enters with two fewer loyalty counters.)+1: Until your next turn, up to one target creature gets -3/-0.−2: Target player mills three cards. Then if a graveyard has twenty or more cards in it, you draw three cards. Otherwise, you draw a card.−X: Target player mills three times X cards.",Mítica,R$ 31.99 
180,"Vraska, Betrayal's Sting",Legendary Planeswalker — Vraska,6,Loyalty: 6,"Compleated ({B/P} can be paid with {B} or 2 life. If life was paid, this planeswalker enters with two fewer loyalty counters.)0: You draw a card and you lose 1 life. Proliferate.−2: Target creature becomes a Treasure artifact with “{T}, Sacrifice this artifact: Add one mana of any color” and loses all other card types and abilities.−9: If target player has fewer than nine poison counters, they get a number of poison counters equal to the difference.",Mítica,R$ 329.00 
181,"Koth, Fire of Resistance",Legendary Planeswalker — Koth,4,Loyalty: 4,"+2: Search your library for a basic Mountain card, reveal it, put it into your hand, then shuffle.−3: Koth, Fire of Resistance deals damage to target creature equal to the number of Mountains you control.−7: You get an emblem with “Whenever a Mountain enters the battlefield under your control, this emblem deals 4 damage to any target.”",Rara,R$ 25.00 
182,"Nissa, Ascended Animist",Legendary Planeswalker — Nissa,7,Loyalty: 7,"Compleated ({G/P} can be paid with {G} or 2 life. For each {G/P} paid with life, this planeswalker enters with two fewer loyalty counters.)+1: Create an X/X green Phyrexian Horror creature token, where X is Nissa, Ascended Animist’s loyalty.−1: Destroy target artifact or enchantment.−7: Until end of turn, creatures you control get +1/+1 for each Forest you control and gain trample.",Mítica,R$ 89.25 
183,"Kaito, Dancing Shadow",Legendary Planeswalker — Kaito,4,Loyalty: 3,"Whenever one or more creatures you control deal combat damage to a player, you may return one of them to its owner’s hand. If you do, you may activate loyalty abilities of Kaito twice this turn rather than only once.+1: Up to one target creature can’t attack or block until your next turn.0: Draw a card.−2: Create a 2/2 colorless Drone artifact creature token with deathtouch and “When this creature leaves the battlefield, each opponent loses 2 life and you gain 2 life.”",Rara,R$ 4.63 
184,"Kaya, Intangible Slayer",Legendary Planeswalker — Kaya,7,Loyalty: 6,"Hexproof+2: Each opponent loses 3 life and you gain 3 life.0: You draw two cards. Then each opponent may scry 1.−3: Exile target creature or enchantment. If it wasn’t an Aura, create a token that’s a copy of it, except it’s a 1/1 white Spirit creature with flying in addition to its other types.",Rara,R$ 13.66 
185,"Lukka, Bound to Ruin",Legendary Planeswalker — Lukka,5,Loyalty: 5,"Compleated ({R/G/P} can be paid with {R}, {G}, or 2 life. If life was paid, this planeswalker enters with two fewer loyalty counters.)+1: Add {R}{G}. Spend this mana only to cast creature spells or activate abilities of creatures.−1: Create a 3/3 green Phyrexian Beast creature token with toxic 1.−4: Lukka deals X damage divided as you choose among any number of target creatures and/or planeswalkers, where X is the greatest power among creatures you controlled as you activated this ability.",Mítica,R$ 13.71 
186,"Nahiri, the Unforgiving",Legendary Planeswalker — Nahiri,4,Loyalty: 5,"Compleated ({R/W/P} can be paid with {R}, {W}, or 2 life. If life was paid, this planeswalker enters with two fewer loyalty counters.)+1: Until your next turn, up to one target creature attacks a player each combat if able.+1: Discard a card, then draw a card.0: Exile target creature or Equipment card with mana value less than Nahiri’s loyalty from your graveyard. Create a token that’s a copy of it. That token gains haste. Exile it at the beginning of the next end step.",Mítica,R$ 9.14 
187,"Tyvar, Jubilant Brawler",Legendary Planeswalker — Tyvar,3,Loyalty: 3,"You may activate abilities of creatures you control as though those creatures had haste.+1: Untap up to one target creature.−2: Mill three cards, then you may return a creature card with mana value 2 or less from your graveyard to the battlefield.",Rara,R$ 17.00 
188,"Teferi, Timebender",Legendary Planeswalker — Teferi,6,Loyalty: 5,+2: Untap up to one target artifact or creature.−3: You gain 2 life and draw two cards.−9: Take an extra turn after this one.,Mítica,R$ 4.64 
189,Karn,Legendary Planeswalker — Karn,0,Loyalty: 4,"+1: Create a tapped Powerstone token. (It’s an artifact with “{T}: Add {C}. This mana can’t be spent to cast a nonartifact spell.”)0: Pay any amount of mana. Look at that many cards from the top of your library, then put one of those cards into your hand and the rest on the bottom of your library in a random order.−6: You get an emblem with “Tap an untapped artifact you control: This emblem deals 1 damage to any target.”",Special,R$ 69.99 
190,"Vraska, Scheming Gorgon",Legendary Planeswalker — Vraska,6,Loyalty: 5,"+2: Creatures you control get +1/+0 until end of turn.−3: Destroy target creature.−10: Until end of turn, creatures you control gain deathtouch and “Whenever this creature deals damage to an opponent, that player loses the game.”",Mítica,R$ 14.99 
