,name,tipo,cmc,lealdade,texto,raridades,preços
191,"Angrath, Minotaur Pirate",Legendary Planeswalker — Angrath,6,Loyalty: 5,"+2: Angrath, Minotaur Pirate deals 1 damage to target opponent or planeswalker and each creature that player or that planeswalker’s controller controls.−3: Return target Pirate card from your graveyard to the battlefield.−11: Destroy all creatures target opponent controls. Angrath, Minotaur Pirate deals damage to that player equal to their total power.",Mítica,R$ 14.61 
192,"Dovin, Grand Arbiter",Legendary Planeswalker — Dovin,3,Loyalty: 3,"+1: Until end of turn, whenever a creature you control deals combat damage to a player, put a loyalty counter on Dovin, Grand Arbiter.−1: Create a 1/1 colorless Thopter artifact creature token with flying. You gain 1 life.−7: Look at the top ten cards of your library. Put three of them into your hand and the rest on the bottom of your library in a random order.",Mítica,R$ 1.47 
193,"Dovin, Architect of Law",Legendary Planeswalker — Dovin,6,Loyalty: 5,+1: You gain 2 life and draw a card.−1: Tap target creature. It doesn’t untap during its controller’s next untap step.−9: Tap all permanents target opponent controls. That player skips their next untap step.,Mítica,R$ 15.57 
194,"Domri, City Smasher",Legendary Planeswalker — Domri,6,Loyalty: 4,"+2: Creatures you control get +1/+1 and gain haste until end of turn.−3: Domri, City Smasher deals 3 damage to any target.−8: Put three +1/+1 counters on each creature you control. Those creatures gain trample until end of turn.",Mítica,R$ 5.84 
195,"Ashiok, Sculptor of Fears",Legendary Planeswalker — Ashiok,6,Loyalty: 4,+2: Draw a card. Each player mills two cards.−5: Put target creature card from a graveyard onto the battlefield under your control.−11: Gain control of all creatures target opponent controls.,Mítica,R$ 12.75 
196,"Ashiok, Nightmare Weaver",Legendary Planeswalker — Ashiok,3,Loyalty: 3,"+2: Exile the top three cards of target opponent’s library.−X: Put a creature card with mana value X exiled with Ashiok, Nightmare Weaver onto the battlefield under your control. That creature is a Nightmare in addition to its other types.−10: Exile all cards from all opponents’ hands and graveyards.",Mítica,R$ 7.90 
197,"Jace, Ingenious Mind-Mage",Legendary Planeswalker — Jace,6,Loyalty: 5,+1: Draw a card.+1: Untap all creatures you control.−9: Gain control of up to three target creatures.,Mítica,R$ 10.50 
198,"Huatli, Dinosaur Knight",Legendary Planeswalker — Huatli,6,Loyalty: 4,+2: Put two +1/+1 counters on up to one target Dinosaur you control.−3: Target Dinosaur you control deals damage equal to its power to target creature you don’t control.−7: Dinosaurs you control get +4/+4 until end of turn.,Mítica,R$ 5.03 
199,Chandra Ablaze,Legendary Planeswalker — Chandra,6,Loyalty: 5,"+1: Discard a card. If a red card is discarded this way, Chandra Ablaze deals 4 damage to any target.−2: Each player discards their hand, then draws three cards.−7: Cast any number of red instant and/or sorcery cards from your graveyard without paying their mana costs.",Mítica,R$ 6.80 
